,title,publish_date,source_country,sentiment,cleaned_text,sentiment_label,word_length,char_length,month
808,Repair bill for Cairngorm funicular expected to come in well over-budget at £25m,2022-11-15 12:26:00,GB,0.05,repair bill cairngorm funicular expected come well over-budget 25m,positive,13,80,November 2022
809,Sicily's rich olive pickings - the fruit of Italy's migrant exploitation,2022-11-12 02:01:58,GB,0.325,sicily rich olive pickings fruit italy migrant exploitation,positive,11,72,November 2022
810,Rishi Sunak holding emergency talks in bid to ease winter NHS crisis,2023-01-07 12:14:20,GB,-0.03,rishi sunak holding emergency talks bid ease winter nhs crisis,negative,12,68,January 2023
811,Jeremy Hunt's autumn statement: UK faces depression and decline unless we recognise the need for a Green New Deal – Joyce McMillan,2022-11-18 05:55:00,GB,-0.21,jeremy hunt autumn statement uk faces depression decline unless recognise need green new deal joyce mcmillan,negative,22,130,November 2022
812,Dancer swaps Swedish Royal Ballet for Fife textile factory,2023-02-07 06:11:00,GB,0.059,dancer swaps swedish royal ballet fife textile factory,positive,9,58,February 2023
813,Talking Point: Would the north of Scotland benefit from a new film studio in the region?,2023-03-12 07:00:45,gb,0.28,talking point would north scotland benefit new film studio region,positive,16,88,March 2023
814,Teaching union 'hopeful' of new pay offer to stop crippling school strikes,2022-11-20 12:09:48,GB,-0.484,teaching union hopeful new pay offer stop crippling school strikes,negative,12,74,November 2022
815,Gateshead-based Tolent Construction enters administration,2023-02-13 17:13:26,GB,-0.344,gateshead-based tolent construction enters administration,negative,5,57,February 2023
816,Want To Join The Skills Revolution? Here's How To Find The Right Schemes For Your Business,2023-01-31 18:30:08,GB,0.192,want join skills revolution find right schemes business,positive,16,90,January 2023
817,We must fight to save cash from a dystopian digital future,2023-02-21 09:34:51,GB,0.026,must fight save cash dystopian digital future,positive,11,58,February 2023
818,‘Vast majority’ of schools in England and Wales affected by teachers’ strike,2023-02-01 17:35:56,GB,-0.212,vast majority schools england wales affected teachers strike,negative,12,76,February 2023
819,Bolton: Primark to leave Crompton Place for former Debenhams unit,2023-03-28 10:49:09,gb,0.106,bolton primark leave crompton place former debenhams unit,positive,10,65,March 2023
820,‘How will I buy?’: housing crisis grips the Netherlands as Dutch go to polls,2023-03-15 15:12:55,gb,-0.006,buy housing crisis grips netherlands dutch go polls,negative,14,76,March 2023
821,Train drivers&amp;rsquo; strike will cripple services as union leaders warn of escalation,2023-01-04 16:48:16,GB,-0.311,train drivers amp rsquo strike cripple services union leaders warn escalation,negative,12,89,January 2023
822,Why Labour will do nothing to protect workers,2023-01-16 06:23:00,GB,0.141,labour nothing protect workers,positive,8,45,January 2023
823,The American PR firm helping Saudi Arabia clean up its image,2022-12-22 13:00:34,GB,-0.175,american pr firm helping saudi arabia clean image,negative,11,60,December 2022
824,New Castle Stuart golf course will be playable by next year,2023-03-24 01:01:38,gb,0.121,new castle stuart golf course playable next year,positive,11,59,March 2023
825,STEWART NICOL: Good housing attracts good employers – and discourages migration in search of better living,2023-01-22 13:00:00,GB,0.332,stewart nicol good housing attracts good employers discourages migration search better living,positive,16,106,January 2023
826,University staff to walk out for 18 days as ambulance workers consider further strikes,2023-01-12 20:55:52,GB,-0.299,university staff walk 18 days ambulance workers consider strikes,negative,14,86,January 2023
827,Scotland’s Tree Oscars 2023,2023-01-30 01:01:00,GB,0.611,scotland tree oscars 2023,positive,4,27,January 2023
829,"Shortfall of 330,000 workers in UK due to Brexit, say thinktanks",2023-01-17 18:52:20,GB,-0.054,shortfall 330 000 workers uk due brexit say thinktanks,negative,11,64,January 2023
830,'Being the only female in my workplace became the norm',2022-11-22 11:00:00,GB,0.424,female workplace became norm,positive,10,55,November 2022
831,"‘If you win the popular imagination, you change the game’: why we need new stories on climate",2023-01-12 07:00:04,GB,0.318,win popular imagination change game need new stories climate,positive,17,93,January 2023
832,Funding Boost For Shapinsay Housing Project,2022-12-09 01:01:00,GB,0.659,funding boost shapinsay housing project,positive,6,43,December 2022
833,insider.co.uk - Scottish business news as it happens,2022-11-01 14:48:02,GB,-0.178,insider co uk scottish business news happens,negative,8,52,November 2022
834,Concern for future of oil and gas industry following energy plan,2023-01-12 10:33:00,GB,-0.189,concern future oil gas industry following energy plan,negative,11,64,January 2023
835,Scottish fish farms hand economy £3.3 billion boost,2023-03-09 12:45:37,gb,0.477,scottish fish farms hand economy 3.3 billion boost,positive,8,51,March 2023
836,IN DEPTH - Planning for a greener Aberdeenshire through new national planning policy,2023-02-14 09:30:00,GB,0.615,depth planning greener aberdeenshire new national planning policy,positive,13,84,February 2023
837,Angry residents plan to stage blockades of road which is routinely gridlocked,2023-02-18 10:31:47,GB,-0.222,angry residents plan stage blockades road routinely gridlocked,negative,12,77,February 2023
838,Underwater testing marks first concrete action at Cromarty Firth following green freeport victory,2023-03-10 18:14:31,gb,0.004,underwater testing marks first concrete action cromarty firth following green freeport victory,positive,13,97,March 2023
839,Phosphorus supply is increasingly disrupted – we are sleepwalking into a global food crisis,2022-12-16 16:48:40,GB,-0.207,phosphorus supply increasingly disrupted sleepwalking global food crisis,negative,14,91,December 2022
840,UK economy shrinks in three months to October as economists warn of recession,2022-12-12 09:05:08,GB,-0.176,uk economy shrinks three months october economists warn recession,negative,13,77,December 2022
841,Department of Work &amp; Pensions plan jobfairs and other events,2023-02-14 14:36:05,GB,0.119,department work amp pensions plan jobfairs events,positive,10,64,February 2023
842,Deborah O&#8217;Neil: BioHub will transform north-east life sciences sector,2023-02-02 07:30:45,GB,0.554,deborah 8217 neil biohub transform north-east life sciences sector,positive,9,75,February 2023
843,Thousands of nurses strike in dispute over pay,2023-01-18 10:02:12,GB,-0.336,thousands nurses strike dispute pay,negative,8,46,January 2023
844,Rishi Sunak’s immigration announcement in full,2022-12-13 14:35:21,GB,0.059,rishi sunak immigration announcement full,positive,6,46,December 2022
845,Forth Valley College's Falkirk campus is officially opened nearly three years after opening to students,2022-12-06 17:01:20,GB,0.176,forth valley college falkirk campus officially opened nearly three years opening students,positive,15,103,December 2022
846,Grant boost for north-east marine and fishing businesses,2022-12-01 08:30:00,GB,0.031,grant boost north-east marine fishing businesses,positive,8,56,December 2022
847,‘A big draw for renters is peace of mind’: what does the build-to-rent model offer the UK’s property market?,2023-02-13 14:19:47,GB,0.207,big draw renters peace mind build-to-rent model offer uk property market,positive,19,108,February 2023
848,Heaven into hell: how a luxury block in Turkey became a mass grave,2023-02-17 13:00:10,GB,-0.435,heaven hell luxury block turkey became mass grave,negative,13,66,February 2023
849,"Since the Network was formed a year ago, 290 women from across the North of England have joined to support the vital work of Fréa partner charities.",2023-03-09 00:11:34,gb,0.731,since network formed year ago 290 women across north england joined support vital work fr partner charities,positive,27,148,March 2023
850,"Up to 2,500 troops could cover striking public sector staff at £10m-a-week cost",2022-12-16 19:48:57,GB,-0.215,2 500 troops could cover striking public sector staff 10m-a-week cost,negative,13,79,December 2022
851,Economy grows in Budget boost to Jeremy Hunt,2023-03-10 09:43:32,gb,0.052,economy grows budget boost jeremy hunt,positive,8,44,March 2023
852,Changeover Technologies to revolutionise carbon dependent sectors,2022-11-04 20:22:53,GB,-0.078,changeover technologies revolutionise carbon dependent sectors,negative,7,65,November 2022
853,A96 McDonalds plan at Huntly moves forward,2023-03-08 16:00:00,gb,0.217,a96 mcdonalds plan huntly moves forward,positive,7,42,March 2023
854,DAVID PATTERSON: Our curious students are determined to make a difference,2023-03-26 19:00:00,gb,0.291,david patterson curious students determined make difference,positive,11,73,March 2023
856,Three times as many died in work accidents in the north as died on World Cup stadiums,2022-12-02 12:43:39,GB,-0.041,three times many died work accidents north died world cup stadiums,negative,17,85,December 2022
857,"Fife: Furniture firm Deanestor hails record orders, turnover",2023-03-22 18:35:43,gb,0.364,fife furniture firm deanestor hails record orders turnover,positive,8,60,March 2023
858,A new start and new opportunities for the New Year at Forth Valley College,2022-11-15 09:22:19,GB,0.422,new start new opportunities new year forth valley college,positive,14,74,November 2022
859,Commodities drive fall as FTSE outperformed by European peers,2023-03-06 18:47:29,gb,-0.062,commodities drive fall ftse outperformed european peers,negative,9,61,March 2023
860,Brazil Ambassador visits the Gaza Strip amid a warm welcome,2022-12-05 20:20:37,GB,0.234,brazil ambassador visits gaza strip amid warm welcome,positive,10,59,December 2022
861,JCB hydrogen digger on road in world first,2023-02-17 10:35:55,GB,0.179,jcb hydrogen digger road world first,positive,8,42,February 2023
862,Perthshire plant hire firm in record-breaking JCB order,2023-03-17 09:24:11,gb,-0.111,perthshire plant hire firm record-breaking jcb order,negative,8,55,March 2023
863,UK construction declines further after sharp fall in housebuilding,2023-02-06 12:00:45,GB,-0.317,uk construction declines sharp fall housebuilding,negative,9,66,February 2023
864,Lineker saga has shown how solidarity gets results,2023-03-15 07:34:32,gb,0.056,lineker saga shown solidarity gets results,positive,8,50,March 2023
865,CMAL hit back at 'mischief-making' over ferry fiasco,2023-02-28 16:47:00,GB,-0.161,cmal hit back mischief-making ferry fiasco,negative,8,52,February 2023
866,"UK migration forecast to hit 245,000 despite Rishi Sunak’s pledge to cut arrivals",2023-03-15 19:39:28,gb,-0.107,uk migration forecast hit 245 000 despite rishi sunak pledge cut arrivals,negative,13,81,March 2023
867,More rail strike disruption as new TUC boss calls for urgent meeting with PM,2023-01-04 09:07:09,GB,-0.251,rail strike disruption new tuc boss calls urgent meeting pm,negative,14,76,January 2023
868,NHS warns public ahead of nurse and ambulance strikes,2023-02-05 19:00:00,GB,0.076,nhs warns public ahead nurse ambulance strikes,positive,9,53,February 2023
869,Owner of Edinburgh's Scotch Malt Whisky Society reveals start-up date for Glasgow bond facility,2022-11-15 08:52:08,GB,0.007,owner edinburgh scotch malt whisky society reveals start-up date glasgow bond facility,positive,14,95,November 2022
870,Stadiums of shame: the numbers World Cup hosts Qatar don’t want to be seen,2022-11-14 22:00:03,GB,-0.166,stadiums shame numbers world cup hosts qatar want seen,negative,14,74,November 2022
871,"Brexit: Amid red wall pandering, some common sense from Labour",2023-01-18 06:31:05,GB,-0.145,brexit amid red wall pandering common sense labour,negative,10,62,January 2023
872,Administrators for Brymor Group report on money owed to creditors,2023-02-17 05:11:49,GB,-0.618,administrators brymor group report money owed creditors,negative,10,65,February 2023
873,Scotland footballers named in New Year Honours list,2022-12-30 23:30:59,GB,0.121,scotland footballers named new year honours list,positive,8,51,December 2022
874,Ghana President Nana Akufo-Addo's cathedral plan stalls amid economic crisis,2023-02-19 01:16:44,GB,0.167,ghana president nana akufo-addo cathedral plan stalls amid economic crisis,positive,10,76,February 2023
875,Great British Nuclear: one step forward to take two steps back?,2023-02-21 15:06:15,GB,-0.164,great british nuclear one step forward take two steps back,negative,11,63,February 2023
876,One&#8217;s projects tailor-made to drive forward north-east economy,2023-02-03 12:45:08,GB,0.616,one 8217 projects tailor-made drive forward north-east economy,positive,8,68,February 2023
877,Siberia is up for grabs as Putin becomes China&#39;s vassal,2023-03-18 11:48:33,gb,0.285,siberia grabs putin becomes china 39 vassal,positive,10,59,March 2023
878,Why are Britain’s teachers striking?,2023-02-02 12:32:26,GB,-0.097,britain teachers striking,negative,5,36,February 2023
879,Proposed strike legislation shows Government is losing argument – Mick Lynch,2023-01-06 12:42:19,GB,-0.375,proposed strike legislation shows government losing argument mick lynch,negative,11,76,January 2023
880,Plans for new office block opposite V&amp;A Dundee set to be approved,2022-12-07 18:06:38,GB,0.085,plans new office block opposite v amp dundee set approved,positive,12,69,December 2022
881,Growth Programme boost helps support more than 850 staff,2023-01-11 07:30:00,GB,0.697,growth programme boost helps support 850 staff,positive,9,56,January 2023
882,Owner of Edinburgh's Scotch Malt Whisky Society reveals start-up date for Glasgow bond facility,2022-11-15 09:18:18,GB,0.007,owner edinburgh scotch malt whisky society reveals start-up date glasgow bond facility,positive,14,95,November 2022
883,SNP to hold ‘Democracy Scotland’ conference on how to secure independence,2022-12-17 14:56:58,GB,0.008,snp hold democracy scotland conference secure independence,positive,11,73,December 2022
884,Peaky Blinder creator's Birmingham film studio to generate 760 jobs,2023-03-21 19:44:36,gb,0.031,peaky blinder creator birmingham film studio generate 760 jobs,positive,10,67,March 2023
885,First tenant for Inverness's new Life Sciences Innovation Centre,2023-03-15 15:48:00,gb,0.126,first tenant inverness new life sciences innovation centre,positive,9,64,March 2023
886,Crypto broker Genesis at risk of bankruptcy as FTX contagion spreads,2022-11-22 14:37:47,GB,-0.22,crypto broker genesis risk bankruptcy ftx contagion spreads,negative,11,68,November 2022
887,Thursday court round-up — Retail raid and street lockdown,2023-03-09 19:26:31,gb,0.632,thursday court round-up retail raid street lockdown,positive,9,57,March 2023
888,SSE profits more than triple as UK energy prices soar,2022-11-16 10:02:34,GB,0.11,sse profits triple uk energy prices soar,positive,10,53,November 2022
889,Anti-strike legislation passes first test but wave of industrial action rolls on,2023-01-17 05:52:05,GB,-0.193,anti-strike legislation passes first test wave industrial action rolls,negative,12,80,January 2023
890,London commuters brace for more rail strike misery as drivers walk out again,2023-02-02 22:40:37,GB,-0.285,london commuters brace rail strike misery drivers walk,negative,13,76,February 2023
891,Watch as Jeremy Hunt announces his spring Budget,2023-03-15 13:33:25,gb,-0.165,watch jeremy hunt announces spring budget,negative,8,48,March 2023
892,Jobseekers should join Britain's growing green economy - and here's how,2022-11-07 01:52:57,GB,0.702,jobseekers join britain growing green economy,positive,11,71,November 2022
893,North-east housing market: Where is it heading in 2023?,2023-02-01 13:13:53,GB,-0.16,north-east housing market heading 2023,negative,9,55,February 2023
894,Anti-strike legislation passes first test but wave of industrial action rolls on,2023-01-17 01:23:07,GB,-0.208,anti-strike legislation passes first test wave industrial action rolls,negative,12,80,January 2023
895,Fans voice fury at Gareth Southgate after Marcus Rashford is benched for Senegal clash,2022-12-04 18:51:12,GB,0.18,fans voice fury gareth southgate marcus rashford benched senegal clash,positive,14,86,December 2022
896,Malton Enterprise Park in North Yorkshire celebrates new deals,2023-01-06 13:30:00,GB,0.169,malton enterprise park north yorkshire celebrates new deals,positive,9,62,January 2023
897,Million of tonnes of steel needed as new energy revolution races ahead,2023-01-04 11:37:20,GB,0.102,million tonnes steel needed new energy revolution races ahead,positive,12,70,January 2023
898,Newcastle set to lead the North East’s 2024-2026 economic growth,2023-03-01 09:00:49,GB,0.103,newcastle set lead north east 2024-2026 economic growth,positive,10,64,March 2023
899,Scottish hotels veteran Paddy Crerar talks sense in febrile times,2023-03-24 06:00:00,gb,-0.131,scottish hotels veteran paddy crerar talks sense febrile times,negative,10,65,March 2023
900,New £7.5m world-class testing facility to be built in Co Down,2022-11-21 01:01:00,GB,0.169,new 7.5m world-class testing facility built co,positive,11,61,November 2022
901,Northern Echo partnership reveals interest rate verdict,2023-02-01 13:31:46,GB,-0.173,northern echo partnership reveals interest rate verdict,negative,7,55,February 2023
902,Northern Ireland businesses see further slowdown at end of 2022,2023-01-16 11:36:06,GB,-0.372,northern ireland businesses see slowdown end 2022,negative,10,63,January 2023
903,Connect scheme at Integra 61 passes midpoint as steel frames completed,2023-03-30 07:00:00,gb,0.47,connect scheme integra 61 passes midpoint steel frames completed,positive,11,70,March 2023
904,"Readers&#8217; Letters: The return of the Fittie bus, the World Cup being held in Qatar and anti-social behaviour on Union Street",2022-11-17 18:00:14,GB,-0.28,readers 8217 letters return fittie bus world cup held qatar anti-social behaviour union street,negative,21,129,November 2022
905,Strikes Bill clears the Commons but legal challenges threatened,2023-01-31 00:49:17,GB,-0.488,strikes bill clears commons legal challenges threatened,negative,9,63,January 2023
906,Council &amp;lsquo;apologises unreservedly for ways in which it failed Grenfell residents&amp;rsquo;,2022-11-09 17:01:01,GB,-0.334,council amp lsquo apologises unreservedly ways failed grenfell residents amp rsquo,negative,11,100,November 2022
907,"NHS strikes: You could be taken to A&E in a taxi, health minister admits",2022-12-12 19:57:07,GB,-0.229,nhs strikes could taken e taxi health minister admits,negative,14,72,December 2022
908,"Davos 2023: What is it, who is attending, and why is it controversial?",2023-01-16 12:51:42,GB,0.294,davos 2023 attending controversial,positive,13,70,January 2023
909,Taxing wealth will never be the answer to Britain’s problems,2023-02-24 11:00:00,GB,-0.364,taxing wealth never answer britain problems,negative,10,60,February 2023
910,Germany’s economic outlook brightens as energy prices fall; UK property asking prices stagnating – business live,2023-02-20 14:41:20,GB,0.121,germany economic outlook brightens energy prices fall uk property asking prices stagnating business live,positive,16,112,February 2023
911,Virgin Orbit secures licences for UK’s first space launch,2022-12-21 08:28:55,GB,0.3,virgin orbit secures licences uk first space launch,positive,9,57,December 2022
912,More maths? Rishi Sunak’s calculation doesn’t add up,2023-01-08 11:00:44,GB,-0.299,maths rishi sunak calculation add,negative,8,52,January 2023
913,Strike by civil servants to go ahead after talks dismissed as ‘total farce’,2023-01-12 12:40:20,GB,-0.451,strike civil servants go ahead talks dismissed total farce,negative,13,75,January 2023
914,"Pastry merger could bump up prices for shoppers, UK watchdog finds",2022-11-04 12:27:50,GB,0.209,pastry merger could bump prices shoppers uk watchdog finds,positive,11,66,November 2022
915,‘So many employees stay and progress’: how social care careers take off at Surrey County Council,2023-02-24 08:16:54,GB,0.267,many employees stay progress social care careers take surrey county council,positive,16,96,February 2023
916,US inflation slowed sharply to 7.1% over past 12 months,2022-12-13 14:54:01,GB,0.068,us inflation slowed sharply 7.1 past 12 months,positive,10,55,December 2022
917,Cigarette break Dundee mental health worker awarded £23k after &#8216;shambolic&#8217; dismissal,2023-02-01 18:04:24,GB,-0.703,cigarette break dundee mental health worker awarded 23k 8216 shambolic 8217 dismissal,negative,11,96,February 2023
918,Labour has learned nothing from its disastrous record of pensions meddling,2023-03-16 14:26:12,gb,0.232,labour learned nothing disastrous record pensions meddling,positive,11,74,March 2023
919,Mike Rowe gets filthy on 'Dirty Jobs' to reconnect Americans,2022-12-12 22:25:56,GB,0.144,mike rowe gets filthy dirty jobs reconnect americans,positive,10,60,December 2022
920,Hopes for workers’ legacy fade after ‘deafening silence’ from Qataris,2022-11-18 11:30:02,GB,-0.2,hopes workers legacy fade deafening silence qataris,negative,10,69,November 2022
921,Teachers hit out at FM over strike claims,2023-01-19 19:08:07,GB,-0.133,teachers hit fm strike claims,negative,8,41,January 2023
922,Family matters: The halo effect that can con us - The Jewish Chronicle,2022-12-16 16:28:43,GB,0.208,family matters halo effect con us jewish chronicle,positive,13,70,December 2022
923,Will a four-day week really work for British businesses and staff?,2023-02-21 12:52:26,GB,-0.357,four-day week really work british businesses staff,negative,11,66,February 2023
924,Scottish Secretary confirmed Scotland’s offshore wind potential at 25% of Europe’s in 2013 – Reporting Scotland Up (Talking-up Scotland),2022-11-14 18:46:35,GB,-0.126,scottish secretary confirmed scotland offshore wind potential 25 europe 2013 reporting scotland talking-up scotland,negative,19,136,November 2022
925,Ignite North East reveals start-ups in its Pre-Accelerator programme,2023-01-05 07:00:00,GB,0.086,ignite north east reveals start-ups pre-accelerator programme,positive,9,68,January 2023
926,Clark Contracts hits £100m turnover landmark as recovery steps up,2023-02-14 06:35:47,GB,0.084,clark contracts hits 100m turnover landmark recovery steps,positive,10,65,February 2023
927,Sturgeon sets out hopes for ‘good relationship’ with new Prime Minister Sunak,2022-11-10 21:31:14,GB,0.002,sturgeon sets hopes good relationship new prime minister sunak,positive,12,77,November 2022
928,Innovative construction firm Radix quadruples size of Dundee base,2023-03-23 06:55:48,gb,0.178,innovative construction firm radix quadruples size dundee base,positive,9,65,March 2023
929,Teachers support strike action as MPs back controversial legislation,2023-01-17 00:29:09,GB,-0.218,teachers support strike action mps back controversial legislation,negative,9,68,January 2023
930,Patients Overwhelmingly Back Striking NHS Key Workers – New Poll,2023-01-19 23:30:14,GB,-0.418,patients overwhelmingly back striking nhs key workers new poll,negative,10,64,January 2023
931,New malting plant now in production at Bairds Malt in Inverness,2023-03-27 13:00:00,gb,0.308,new malting plant production bairds malt inverness,positive,11,63,March 2023
932,UK health secretary says nurses’ pay demands not ‘reasonable or affordable’,2022-11-13 00:16:11,GB,-0.071,uk health secretary says nurses pay demands reasonable affordable,negative,11,75,November 2022
933,Ohio's Intel project triggers housing fears in tight market,2022-11-19 15:01:36,GB,-0.048,ohio intel project triggers housing fears tight market,negative,9,59,November 2022
934,Gove strips housing association’s funding after Awaab Ishak’s death due to mould,2022-11-24 08:07:28,GB,-0.482,gove strips housing association funding awaab ishak death due mould,negative,12,80,November 2022
935,Year of the Rabbit could bring hope as China fully reopens after Covid,2023-01-14 06:00:00,GB,-0.223,year rabbit could bring hope china fully reopens covid,negative,13,70,January 2023
936,Uist distillery developers launch trio of new spirits,2023-01-24 12:13:07,GB,0.797,uist distillery developers launch trio new spirits,positive,8,53,January 2023
937,Serious concerns raised in NZ about environmental impact of major productions including Amazon’s Rings of Power,2022-11-08 22:00:10,GB,-0.101,serious concerns raised nz environmental impact major productions including amazon rings power,negative,16,111,November 2022
938,Nursing strike enters second day as health leaders prepare for biggest walkout,2023-01-19 01:24:07,GB,0.062,nursing strike enters second day health leaders prepare biggest walkout,positive,12,78,January 2023
939,Ministers could offer one-off payments as way to end public sector strikes,2023-02-22 20:22:10,GB,-0.345,ministers could offer one-off payments way end public sector strikes,negative,12,74,February 2023
940,Scotland’s First Minister marks launch of UK’s tallest onshore turbines,2022-11-16 14:00:14,GB,0.41,scotland first minister marks launch uk tallest onshore turbines,positive,10,71,November 2022
941,2 rivals from factory floors facing off in race to lead UAW,2023-02-02 16:32:09,GB,-0.013,2 rivals factory floors facing race lead uaw,negative,12,59,February 2023
942,Strike by civil servants to go ahead after talks dismissed as ‘total farce’,2023-01-12 13:08:10,GB,-0.469,strike civil servants go ahead talks dismissed total farce,negative,13,75,January 2023
943,Threat of recession remains a concern ahead of the release of GDP figures,2023-02-09 16:43:47,GB,-0.423,threat recession remains concern ahead release gdp figures,negative,13,73,February 2023
